,Title,Authors,Year
0,"Miss Peregrine's Home for Peculiar Children (Miss Peregrine's Peculiar Children, #1)",Ransom Riggs,2011
1,"Children of Blood and Bone (Legacy of Orïsha, #1)",Tomi Adeyemi,2018
2,"The Clan of the Cave Bear (Earth's Children, #1)",Jean M. Auel,1980
3,"Hollow City (Miss Peregrine's Peculiar Children, #2)",Ransom Riggs,2014
4,"Library of Souls (Miss Peregrine's Peculiar Children, #3)",Ransom Riggs,2015
5,"Every Heart a Doorway (Wayward Children, #1)",Seanan McGuire,2016
6,"Among the Hidden (Shadow Children, #1)",Margaret Peterson Haddix,1998
7,"The Boxcar Children (The Boxcar Children, #1)",Gertrude Chandler Warner,1942
8,"Children of the Mind (Ender's Saga, #4)",Orson Scott Card,1996
9,Children of Dune (Dune Chronicles #3),Frank Herbert,1976
10,The Children of Húrin,J.R.R. Tolkien,2007
11,Children of Time (Children of Time #1),Adrian Tchaikovsky,2015
12,The Children Act,Ian McEwan,2014
13,"The Valley of Horses (Earth's Children, #2)",Jean M. Auel,1982
14,"Children of Virtue and Vengeance (Legacy of Orïsha, #2)",Tomi Adeyemi,2019
15,Midnight's Children,Salman Rushdie,1981
16,"The Mammoth Hunters (Earth's Children, #3)",Jean M. Auel,1985
17,The Children of Men,P.D. James,1992
18,"Tales of the Peculiar (Miss Peregrine's Peculiar Children, #0.5)",Ransom Riggs,2016
19,The Railway Children,E. Nesbit,1906
20,Where Are the Children?,Mary Higgins Clark,1975
21,"The Plains of Passage (Earth's Children, #4)",Jean M. Auel,1990
22,"How Children Succeed: Grit, Curiosity, and the Hidden Power of Character",Paul Tough,2012
23,"Far from the Tree: Parents, Children, and the Search for Identity",Andrew Solomon,2012
24,"Midnight for Charlie Bone (The Children of the Red King, #1)",Jenny Nimmo,2002
25,"The Shelters of Stone (Earth's Children, #5)",Jean M. Auel,1980
26,"A Map of Days (Miss Peregrine's Peculiar Children, #4)",Ransom Riggs,2018
27,"Down Among the Sticks and Bones (Wayward Children, #2)",Seanan McGuire,2017
28,Little Princes: One Man's Promise to Bring Home the Lost Children of Nepal,Conor Grennan,2011
29,"Beneath the Sugar Sky (Wayward Children, #3)",Seanan McGuire,2018
30,Suffer the Children,John Saul,1977
31,Little Children,Tom Perrotta,2004
32,The Children of Henry VIII,Alison Weir,1996
33,"The Land of Painted Caves (Earth's Children, #6)",Jean M. Auel,2011
34,NurtureShock: New Thinking About Children,Po Bronson,2008
35,The Mysterious Howling (The Incorrigible Children of Ashton Place #1),Maryrose Wood,2009
36,Before and After: The Incredible Real-Life Stories of Orphans Who Survived the Tennessee Children's Home Society,Judy Christie,2019
37,Lost Children Archive,Valeria Luiselli,2019
38,"Among the Impostors (Shadow Children, #2)",Margaret Peterson Haddix,2001
39,The Five Love Languages of Children,Gary Chapman,1995
40,Five Children and It (Five Children #1),E. Nesbit,1902
41,"Among the Betrayed (Shadow Children, #3)",Margaret Peterson Haddix,2002
42,The Emperor's Children,Claire Messud,2006
43,"Among the Barons (Shadow Children, #4)",Margaret Peterson Haddix,2003
44,Savage Inequalities: Children in America's Schools,Jonathan Kozol,1991
45,The Children's Book,A.S. Byatt,2009
46,"Among the Brave (Shadow Children, #5)",Margaret Peterson Haddix,2004
47,"In an Absent Dream (Wayward Children, #4)",Seanan McGuire,2019
48,"Charlie Bone and the Castle of Mirrors (The Children of the Red King, #4)",Jenny Nimmo,2005
49,"Charlie Bone and the Hidden King (The Children of the Red King, #5)",Jenny Nimmo,2006
50,"Among the Enemy (Shadow Children, #6)",Margaret Peterson Haddix,2005
51,There are No Children Here: The Story of Two Boys Growing Up in the Other America,Alex Kotlowitz,1991
52,"Charlie Bone and the Invisible Boy (The Children of the Red King, #3)",Jenny Nimmo,2004
53,"Charlie Bone and the Time Twister (The Children of the Red King, #2)",Jenny Nimmo,2003
54,Last Child in the Woods: Saving Our Children from Nature-Deficit Disorder,Richard Louv,2005
55,Dark Stranger: The Dream (The Children of the Gods #1),I.T. Lucas,2015
56,"Children of God (The Sparrow, #2)",Mary Doria Russell,1998
57,"The Akhenaten Adventure (Children of the Lamp, #1)",P.B. Kerr,2004
58,"Among the Free (Shadow Children, #7)",Margaret Peterson Haddix,2006
59,"Charlie Bone and the Beast (The Children of the Red King, #6)",Jenny Nimmo,2007
60,Methuselah's Children,Robert A. Heinlein,1958
61,"Armageddon's Children (Genesis of Shannara, #1)",Terry Brooks,2006
62,"Miss Peregrine's Home for Peculiar Children: The Graphic Novel (Miss Peregrine's Peculiar Children Graphic Novels, #1)",Ransom Riggs,2011
63,Beautiful Music for Ugly Children,Kirstin Cronn-Mills,2012
64,All the Little Children,Jo Furniss,2017
65,"Charlie Bone and the Shadow (The Children of the Red King, #7)",Jenny Nimmo,2008
66,"Children of Eden (Children of Eden, #1)",Joey Graceffa,2016
67,"The Conference of the Birds (Miss Peregrine's Peculiar Children, #5)",Ransom Riggs,2020
68,The Children's Hour,Lillian Hellman,1934
69,The Children's Blizzard,David Laskin,2004
70,"Come Tumbling Down (Wayward Children, #5)",Seanan McGuire,2020
71,"Rumors of War (Children of the Promise, #1)",Dean Hughes,1997
72,Mother Courage and Her Children,Bertolt Brecht,1941
73,Shade's Children,Garth Nix,1997
74,The Mapmaker's Children,Sarah McCoy,2014
75,The Children's Crusade,Ann Packer,2015
76,The Man Who Loved Children,Christina Stead,1940
77,"Blue Remembered Earth (Poseidon's Children, #1)",Alastair Reynolds,2012
78,The Girls Who Went Away: The Hidden History of Women Who Surrendered Children for Adoption in the Decades Before Roe V. Wade,Ann Fessler,2006
79,"The Inquisitor's Tale: Or, the Three Magical Children and Their Holy Dog",Adam Gidwitz,2016
80,My Real Children,Jo Walton,2014
81,Children Playing Before a Statue of Hercules,David Sedaris,2005
82,Children of Ruin (Children of Time #2),Adrian Tchaikovsky,2019
83,"The Blue Djinn of Babylon (Children of the Lamp, #2)",P.B. Kerr,2005
84,The Children,Ann Leary,2016
85,"The Children of Green Knowe (Green Knowe, #1)",Lucy M. Boston,1954
86,Acid For The Children,Flea,2019
87,The Gift of Failure: How the Best Parents Learn to Let Go So Their Children Can Succeed,Jessica Lahey,2014
88,Wise Children,Angela Carter,1991
89,Children of Earth and Sky,Guy Gavriel Kay,2016
90,"Surprise Island (The Boxcar Children, #2)",Gertrude Chandler Warner,1949
91,James Herriot's Treasury for Children: Warm and Joyful Tales by the Author of All Creatures Great and Small,James Herriot,1992
92,The Enchanted Castle and Five Children and It,E. Nesbit,1907
93,Children of the Corn,Stephen King,1977
94,"The Cobra King of Kathmandu (Children of the Lamp, #3)",P.B. Kerr,2006
95,"The Yellow House Mystery (The Boxcar Children, #3)",Gertrude Chandler Warner,1952
96,"The Gifts of Imperfect Parenting: Raising Children with Courage, Compassion, and Connection",Brené Brown,-1
97,"Ringworld's Children (Ringworld, #4)",Larry Niven,2004
98,"Charlie Bone and the Red Knight (Children of the Red King, #8)",Jenny Nimmo,2009
99,"Damia's Children (The Tower and the Hive, #3)",Anne McCaffrey,1993
100,Survivors: True Stories of Children in the Holocaust,Allan Zullo,2004
101,Adult Children of Emotionally Immature Parents,Lindsay C. Gibson,2015
102,The Phoenix and the Carpet (Five Children #2),E. Nesbit,1904
103,"Shifter (Includes: Warriors of Poseidon #2.5; Breeds #11.5; Feline Breeds, #9; Children of the Sea Prequel)",Angela Knight,2008
104,"Children of the Jedi (Star Wars: The Callista Trilogy, #1)",Barbara Hambly,1995
105,The Throwaway Children,Diney Costeloe,2015
106,Stolen Children,Peg Kehret,2008
107,Children Make Terrible Pets,Peter  Brown,2010
108,Children of the Flames: Dr. Josef Mengele and the Untold Story of the Twins of Auschwitz,Lucette  Lagnado,1991
109,"Burning Up (Psy-Changeling, #0.5; Children of the Sea, #3.5; Iron Seas, #0.5)",Angela Knight,2010
110,The Hidden Gallery (The Incorrigible Children of Ashton Place #2),Maryrose Wood,2010
111,All God's Children Need Traveling Shoes,Maya Angelou,1986
112,"Dark Stranger Revealed (The Children of the Gods, #2)",I.T. Lucas,2015
113,"The Conscious Parent: Transforming Ourselves, Empowering Our Children",Shefali Tsabary,2010
114,Children of the Night,Dan Simmons,1992
115,Chosen By God: Know God's Perfect Plan for His Glory and His Children,R.C. Sproul,1986
116,The Small Backs of Children,Lidia Yuknavitch,2015
117,"Ravished by a Highlander (Children of the Mist, #1)",Paula Quinn,2010
118,Other People's Children: Cultural Conflict in the Classroom,Lisa Delpit,1995
119,Mercy Among the Children,David Adams Richards,2000
120,Perfect Little Children,Sophie Hannah,2020
121,How to Talk so Little Kids Will Listen: A Survival Guide to Life with Children Ages 2-7,Joanna Faber,2017
122,Siblings Without Rivalry: How to Help Your Children Live Together So You Can Live Too,Adele Faber,1987
123,Free-Range Kids: Giving Our Children the Freedom We Had Without Going Nuts with Worry,Lenore Skenazy,2009
124,The Children of Noisy Village,Astrid Lindgren,1946
125,"Lucifer, Vol. 2: Children and Monsters",Mike Carey,2001
126,"Since You Went Away (Children of the Promise, #2)",Dean Hughes,1997
127,Cautionary Tales for Children,Hilaire Belloc,1907
128,Saturn's Children (Freyaverse #1),Charles Stross,2008
129,"The Story of the Treasure Seekers (Bastable Children, #1)",E. Nesbit,1899
130,There Is No Me Without You: One Woman's Odyssey to Rescue Africa's Children,Melissa Fay Greene,2006
131,Leaving Microsoft to Change the World: An Entrepreneur's Odyssey to Educate the World's Children,John Wood,2006
132,"Dark Stranger Immortal (The Children of the Gods, #3)",I.T. Lucas,2015
133,"Oppression (Children of the Gods, #1)",Jessica Therrien,2012
134,"The Children of the Sky  (Zones of Thought, #3)",Vernor Vinge,2011
135,"Dark Enemy Taken (The Children of the Gods, #4)",I.T. Lucas,2015
136,"Children of the Storm (Amelia Peabody, #15)",Elizabeth Peters,2003
137,"The Prodigal Mage (Fisherman's Children, #1)",Karen Miller,2009
138,"Irena's Children: The Extraordinary Story of the Woman Who Saved 2,500 Children from the Warsaw Ghetto",Tilar J. Mazzeo,2016
139,"Your House Is on Fire, Your Children All Gone",Stefan Kiesbye,2012
140,"The Boxcar Children 1-4 (The Boxcar Children, #1-4)",Gertrude Chandler Warner,1942
141,"When We Meet Again (Children of the Promise, #4)",Dean Hughes,2001
142,Children of the Jacaranda Tree,Sahar Delijani,2013
143,"Mystery Ranch (The Boxcar Children, #4)",Gertrude Chandler Warner,1957
144,1-2-3 Magic: Effective Discipline for Children 2-12,Thomas W. Phelan,1995
145,Wolf Children: Ame & Yuki,Mamoru Hosoda,2012
146,Amazing Grace: The Lives of Children and the Conscience of a Nation,Jonathan Kozol,1995
147,"The Day of the Djinn Warriors (Children of the Lamp, #4)",P.B. Kerr,2007
148,The Aesop for Children,Aesop,-1
149,"Far From Home (Children of the Promise, #3)",Dean Hughes,1998
150,"As Long As I Have You (Children of the Promise, #5)",Dean Hughes,2000
151,"Dark Enemy Captive (The Children of the Gods, #5)",I.T. Lucas,2015
152,Twilight Children: Three Voices No One Heard Until a Therapist Listened,Torey L. Hayden,2005
153,The Book You Wish Your Parents Had Read,Philippa Perry,2019
154,"The Unseen Guest (The Incorrigible Children of Ashton Place, #3)",Maryrose Wood,2012
155,Children of the New World,Alexander Weinstein,2016
156,Healing the Child Within: Discovery and Recovery for Adult Children of Dysfunctional Families,Charles L. Whitfield,1987
157,"Mona Lisa Awakening (Monère: Children of the Moon, #1)",Sunny,2002
158,How Children Learn,John Holt,1967
159,"Dark Enemy Redeemed (The Children of the Gods, #6)",I.T. Lucas,2016
160,"On the Steel Breeze (Poseidon's Children, #2)",Alastair Reynolds,2013
161,Children's Book of Virtues,William J. Bennett,1995
162,Phenomena: The Lost and Forgotten Children,Susan Tarr,2013
163,"Mike's Mystery (The Boxcar Children, #5)",Gertrude Chandler Warner,1960
164,It Takes a Village: And Other Lessons Children Teach Us,Hillary Rodham Clinton,1995
165,"Boundaries with Kids: When to Say Yes, When to Say No to Help Your Children Gain Control of Their Lives",Henry Cloud,1998
166,Containment (Children of Occam #1),Christian Cantrell,2010
167,"The Clan of the Cave Bear, the Valley of Horses, the Mammoth Hunters, the Plains of Passage (Earth's Children, #1-4)",Jean M. Auel,1986
168,Darwin's Children (Darwin's Radio #2),Greg Bear,2002
169,"Children of the Arbat (Arbat Tetralogy, #1)",Anatoli Rybakov,1987
170,Wild Things: The Joy of Reading Children's Literature as an Adult,Bruce Handy,2017
171,The Children's Hospital,Chris Adrian,2006
172,"Children of Vice (Children of Vice, #1)",J.J. McAvoy,2017
173,"Free to Learn: Why Unleashing the Instinct to Play Will Make Our Children Happier, More Self-Reliant, and Better Students for Life",Peter O. Gray,2013
174,Books for Kids: LOL! (Funny Jokes for Kids): 101 Jokes for Kids - Games & Puzzles - Kids Jokes - Jokes for Children,Johnny B. Laughing,2015
175,"The Lighthouse Mystery (The Boxcar Children, #8)",Gertrude Chandler Warner,1962
176,"Children of the Night (Diana Tregarde, #2)",Mercedes Lackey,1990
177,"Dark Warrior Mine (The Children of the Gods, #7)",I.T. Lucas,2016
178,"Elites of Eden (Children of Eden, #2)",Joey Graceffa,2017
179,Cries Unheard: Why Children Kill: The Story of Mary Bell,Gitta Sereny,1998
180,The Story of the Amulet (Five Children #3),E. Nesbit,1906
181,"Awakening (Children of the After, #1)",Jeremy Laszlo,2013
182,"If I Can't Have You: Susan Powell, Her Mysterious Disappearance, and the Murder of Her Children",Gregg Olsen,2014
183,"The Eye Of The Forest (Children Of The Lamp, #5)",P.B. Kerr,2008
184,The Children's Home,Charles Lambert,2016
185,The Children of the New Forest,Frederick Marryat,1847
186,In the Name of the Children: An FBI Agent's Relentless Pursuit of the Nation's Worst Predators,Jeffrey L. Rinek,2018
187,"The Reluctant Mage (Fisherman's Children, #2)",Karen Miller,2010
188,"Shadow Children Complete Set, Books 1-7: Among the Hidden, Among the Impostors, Among the Betrayed, Among the Barons, Among the Brave, Among the Enemy, and Among the Free",Margaret Peterson Haddix,2008
189,The Highly Sensitive Child: Helping Our Children Thrive When the World Overwhelms Them,Elaine N. Aron,2002
190,For the Children's Sake,Susan Schaeffer Macaulay,1984
191,The World’s Worst Children,David Walliams,-1
192,"Blue Bay Mystery (The Boxcar Children, #6)",Gertrude Chandler Warner,1961
193,"Dark Warrior's Promise (The Children of the Gods, #8)",I.T. Lucas,2016
194,Avengers: The Children's Crusade,Allan Heinberg,2012
195,"The Interrupted Tale (The Incorrigible Children of Ashton Place, #4)",Maryrose Wood,2013
196,50 Children: One Ordinary American Couple's Extraordinary Rescue Mission into the Heart of Nazi Germany,Steven Pressman,2014
197,"Schoolhouse Mystery (The Boxcar Children, #10)",Gertrude Chandler Warner,1965
198,"Enthralled (Breeds #19.5; League of the Black Swan #1.5; Iron Seas #3.5, Children of the Moon #3.5)",Lora Leigh,2013
199,The Charmed Children of Rookskill Castle,Janet Fox,2016
200,"The Godless (Children, #1)",Ben Peek,2014
201,Einstein Never Used Flashcards: How Our Children Really Learn--and Why They Need to Play More and Memorize Less,Kathy Hirsh-Pasek,2003
202,Children of the Fog,Cheryl Kaye Tardif,2011
203,Night's Kiss,Amanda Ashley,2005
204,"Hollow City (Miss Peregrine's Peculiar Children Graphic Novels, #2)",Ransom Riggs,2016
205,"The Woodshed Mystery (The Boxcar Children, #7)",Gertrude Chandler Warner,1962
206,"Dark Warrior's Destiny (The Children of the Gods, #9)",I.T. Lucas,2016
207,The Nurture Assumption: Why Children Turn Out the Way They Do,Judith Rich Harris,1998
208,Dark Warrior's Legacy (The Children of the Gods #10),I.T. Lucas,2017
209,Poe's Children: The New Horror,Peter Straub,2008
210,Funny Jokes (FREE Joke Book Download Included!): 125+ Hilarious Jokes (Funny and Hilarious Joke Book for Children),Johnny B. Laughing,2014
211,"Suffer the Little Children (Commissario Brunetti, #16)",Donna Leon,2007
212,Dark Guardian Found (Children of the Gods #11),I.T. Lucas,2017
213,Adult Children of Alcoholics,Janet Geringer Woititz,1983
214,How Children Fail,John Holt,1964
215,"Sea Witch (Children of the Sea, #1)",Virginia Kantra,2008
216,Uncle Tom's Children,Richard Wright,-1
217,The Runaway Children,Sandy Taylor,2017
218,"Poseidon’s Children (The Legacy of the Gods, #1)",Michael  West,2012
219,The Fyfield Plantation (Arcadia’s Children #2),Andrew R.  Williams,-1
220,"The Writing on the Wall (Hearts of the Children, #1)",Dean Hughes,2001
221,Walk on Water: The Miracle of Saving Children's Lives,Michael Ruhlman,2003
222,Choice Words: How Our Language Affects Children's Learning,Peter H. Johnston,2004
223,Dark Guardian Craved (Children of the Gods #12),I.T. Lucas,2017
224,Fortune's Children: The Fall of the House of Vanderbilt,Arthur T. Vanderbilt II,1989
225,A Choir of Ill Children,Tom Piccirilli,2003
226,How to Teach Your Children Shakespeare,Ken Ludwig,2013
227,"Children of the Revolution (Inspector Banks, #21)",Peter Robinson,2013
228,Fire in the Ashes: Twenty-Five Years Among the Poorest Children in America,Jonathan Kozol,2012
229,Protecting the Gift: Keeping Children and Teenagers Safe,Gavin de Becker,1999
230,Children of the Fleet (Fleet School #1),Orson Scott Card,2017
231,"Mountain Top Mystery (The Boxcar Children, #9)",Gertrude Chandler Warner,1964
232,Dark Angel’s Obsession (The Children of the Gods #14),I.T. Lucas,-1
233,Dark Guardian's Mate (The Children of the Gods #13),I.T. Lucas,2017
234,The Gardener and the Carpenter: What the New Science of Child Development Tells Us About the Relationship Between Parents and Children,Alison Gopnik,2016
235,"Unknown (Miss Peregrine's Peculiar Children, #6)",Ransom Riggs,-1
236,"Caboose Mystery (The Boxcar Children, #11)",Gertrude Chandler Warner,1966
237,The Ministry of Motherhood: Following Christ's Example in Reaching the Hearts of Our Children,Sally Clarkson,2004
238,"Houseboat Mystery (The Boxcar Children, #12)",Gertrude Chandler Warner,1967
239,Letters to Children,C.S. Lewis,1985
240,The Concubine's Children,Denise Chong,1994
241,"The Unmapped Sea (The Incorrigible Children of Ashton Place, #5)",Maryrose Wood,2015
242,"We the Children (Benjamin Pratt & the Keepers of the School, #1)",Andrew Clements,2010
243,"100 Essays I Don't Have Time to Write: On Umbrellas and Sword Fights, Parades and Dogs, Fire Alarms, Children, and Theater",Sarah Ruhl,2012
244,Dark Angel's Surrender (The Children of the Gods #16),I.T. Lucas,-1
245,Dark Angel's Seduction (The Children of the Gods #15),I.T. Lucas,-1
246,"Snowbound Mystery (The Boxcar Children, #13)",Gertrude Chandler Warner,1968
247,"Tree House Mystery (The Boxcar Children, #14)",Gertrude Chandler Warner,1969
248,"Moon Awakening (Children of the Moon, #1)",Lucy Monroe,2007
249,"The Children of Willesden Lane. Beyond the Kindertransport: A Memoir of Music, Love, and Survival",Mona Golabek,2002
250,Children of the Land,Marcelo Hernandez Castillo,2020
251,Women & Children First,Gill Paul,2012
252,Children to a Degree: Growing Up Under the Third Reich Book 1,Horst Christian,2013
253,The Children of Cthulhu: Chilling New Tales Inspired by H.P. Lovecraft,John Pelan,2003
254,Dark Operative: A Shadow of Death (The Children of the Gods #17),I.T. Lucas,-1
255,Children in the Holocaust and World War II: Their Secret Diaries,Laurel Holliday,1995
256,"Tamed by a Highlander (Children of the Mist, #3)",Paula Quinn,2011
257,One Year Off: Leaving It All Behind for a Round-the-World Journey with Our Children,David Elliot Cohen,1999
258,"The Child Whisperer: The Ultimate Handbook for Raising Happy, Successful, Cooperative Children",Carol  Tuttle,2012
259,"Willy the Whale: Short Stories, Games, and Jokes!",Uncle Amon,2015
260,"Balanced and Barefoot: How Unrestricted Outdoor Play Makes for Strong, Confident, and Capable Children",Angela J. Hanscom,2016
261,Revolt in 2100/Methuselah's Children,Robert A. Heinlein,1998
262,Spike the Dinosaur,Uncle Amon,2015
263,Dark Operative a Glimmer of Hope (The Children of the Gods #18),I.T. Lucas,-1
264,"Mud Season: How One Woman's Dream of Moving to Vermont, Raising Children, Chickens and Sheep, and Running the Old Country Store Pretty Much Led to One Calamity After Another",Ellen Stimson,2013
265,Creepy Susie and 13 Other Tragic Tales for Troubled Children,Angus Oblong,1999
266,"Beowulf's Children (Heorot, #2)",Larry Niven,1995
267,"Poseidon's Wake (Poseidon's Children, #3)",Alastair Reynolds,2015
268,All Aunt Hagar's Children: Stories,Edward P. Jones,2006
269,Prayers for Children,Eloise Wilkin,1952
270,All Good Children,Catherine Austen,2011
271,Children of the Nameless,Brandon Sanderson,2018
272,The Elephant Keepers' Children,Peter Høeg,2010
273,Miss Peregrine's Peculiar Children Boxed Set (Miss Peregrine's Peculiar Children #1-3),Ransom Riggs,2015
274,The Problim Children,Natalie Lloyd,2018
275,Miss Moore Thought Otherwise: How Anne Carroll Moore Created Libraries for Children,Jan Pinborough,2013
276,"The Shadow Children (Demon-Born Trilogy, #1)",L.C. Hibbett,2016
277,The 20th Century Children's Book Treasury: Celebrated Picture Books and Stories to Read Aloud,Janet Schulman,1998
278,"The Clan of the Cave Bear & The Valley of Horses (Earth's Children, #1-2)",Jean M. Auel,1980
279,The Workhouse Children (Black Country #1),Lindsey Hutchinson,2016
280,Buddhism for Mothers: A Calm Approach to Caring for Yourself and Your Children,Sarah Napthali,2003
281,Irena's Children: A True Story of Courage,Tilar J. Mazzeo,2016
282,The Unschooled Mind: How Children Think and How Schools Should Teach,Howard Gardner,1991
283,From Cradle to Grave: The Short Lives and Strange Deaths of Marybeth Tinning's Nine Children,Joyce Egginton,1989
284,"Bicycle Mystery (The Boxcar Children, #15)",Gertrude Chandler Warner,1970
285,Dark Survivor Awakened (The Children of the Gods #20),I.T. Lucas,-1
286,"Mona Lisa Blossoming (Monère: Children of the Moon, #2)",Sunny,2007
287,"Coalescent (Destiny's Children, #1)",Stephen Baxter,2003
288,The Children of Odin: The Book of Northern Myths,Padraic Colum,1920
289,Children of the Dust,Louise Lawrence,1985
290,Under the Hawthorn Tree (Children of the Famine #1),Marita Conlon-McKenna,1990
291,Praying Circles around Your Children,Mark Batterson,2012
292,"The Call of Agon (The Children of Telm, #1)",Dean F. Wilson,2013
293,"Troubled Waters (Hearts of the Children, #2)",Dean Hughes,2002
294,The Beginner's Bible: Timeless Children's Stories,Kelly Pulley,2005
295,The Jaguar's Children,John Vaillant,2015
296,"Moon Craving (Children of the Moon, #2)",Lucy Monroe,2010
297,Children of the Dark,Jonathan Janz,2016
298,"The Five Fakirs of Faizabad (Children of the Lamp, #6)",P.B. Kerr,2010
299,Dark Survivor Reunited (The Children of the Gods #22),I.T. Lucas,-1
300,"Children of the Sea, Volume 1 (Children of the Sea, #1)",Daisuke Igarashi,2007
301,Helping Children Succeed: What Works and Why,Paul Tough,-1
302,Sacred Parenting: How Raising Children Shapes Our Souls,Gary L. Thomas,2004
303,Beautiful Children,Charles Bock,2008
304,The Life of Our Lord: Written for His Children During the Years 1846 to 1849,Charles Dickens,1934
305,"Children of Ambition (Children of Vice, #2)",J.J. McAvoy,2017
306,"The Philosophical Baby: What Children's Minds Tell Us About Truth, Love, and the Meaning of Life",Alison Gopnik,2003
307,Shadow Children (Boxed Set): Among the Hidden; Among the Impostors; Among the Betrayed; Among the Barons,Margaret Peterson Haddix,2004
308,Dark Survivor Echoes of Love (The Children of the Gods #21),I.T. Lucas,-1
309,French Children Don't Throw Food,Pamela Druckerman,2012
310,"Beyond the Sling: A Real-Life Guide to Raising Confident, Loving Children the Attachment Parenting Way",Mayim Bialik,2012
311,"The Long-Lost Home (The Incorrigible Children of Ashton Place, #6)",Maryrose Wood,2018
312,Rachel and Her Children: Homeless Families in America,Jonathan Kozol,1987
313,"They Fight Like Soldiers, They Die Like Children: The Global Quest to Eradicate the Use of Child Soldiers",Roméo Dallaire,2010
314,"Children of the Vampire (The Diaries of the Family Dracul, #2)",Jeanne Kalogridis,1995
315,We've Got a Job: The 1963 Birmingham Children's March,Cynthia Levinson,2012
316,"Mystery in the Sand (The Boxcar Children, #16)",Gertrude Chandler Warner,1971
317,"Goddess’s Choice (The Children Of The Gods Origins, #1)",I.T. Lucas,2018
318,Reading Magic: Why Reading Aloud to Our Children Will Change Their Lives Forever,Mem Fox,2001
319,"Conquered by a Highlander (Children of the Mist, #4)",Paula Quinn,2015
320,Silly Jokes for Silly Kids. Children's joke book age 4-9,Silly Willy,2014
321,"Heidi's Children (Heidi sequel, #3)",Charles Tritten,1939
322,Ungovernable: The Victorian Parent's Guide to Raising Flawless Children,Therese Oneill,2019
323,The Last Children of Tokyo,Yōko Tawada,2014
324,"Take Me Home (Hearts of the Children, #4)",Dean Hughes,2004
325,"Shatter (The Children of Man, #1)",Elizabeth C. Mock,2010
326,The Random House Book of Poetry for Children,Jack Prelutsky,1983
327,"The Silent Children (DI Robyn Carter, #4)",Carol Wyer,2017
328,"The Duke's Children (Palliser, #6)",Anthony Trollope,1880
329,"Mona Lisa Craving (Monère: Children of the Moon, #3)",Sunny,2008
330,The Children of Jocasta,Natalie Haynes,2017
331,"Raising Our Children, Raising Ourselves: Transforming parent-child relationships from reaction and struggle to freedom, power and joy",Naomi Aldort,2006
332,Dark Widow’s Secret (The Children of the Gods #23),I.T. Lucas,-1
333,Becoming Brilliant: What Science Tells Us about Raising Successful Children,Roberta Michnick Golinkoff,2016
334,Children and Fire,Ursula Hegi,2011
