,Title,Authors,Year
931,"How to Behave So Your Children Will, Too!",Sal Severe,1997
932,"The Cereal Box Mystery (The Boxcar Children, #65)",Gertrude Chandler Warner,1998
933,"1,001 Boredom Busting Play Ideas: Free and Low Cost Crafts, Activities, Games and Family Fun That Will Help You Raise Happy, Healthy Children",Jean Oram,2015
934,A Joyful Mother of Children: The Magic and Mayhem of Motherhood,Linda Eyre,1983
935,"The Mystery at Peacock Hall (The Boxcar Children, #63)",Gertrude Chandler Warner,1998
936,"The Summer Camp Mystery (The Boxcar Children, #82)",Gertrude Chandler Warner,2001
937,"Engaging Autism: Helping Children Relate, Communicate and Think with the DIR Floortime Approach (A Merloyd Lawrence Book)",Stanley I. Greenspan,2006
938,Children On Their Birthdays,Truman Capote,1976
939,Great Stories for Children,Ruskin Bond,2011
940,Done With The Crying: Help and Healing for Mothers of Estranged Adult Children,Sheri McGregor,-1
941,"Good Night, Good Night: A Going to Sleep Picture Book - A Rhyming Bedtime Story, Early/Beginner Readers, Children's book, Picture Book, kids book collection, Funny humor ebook, Education",Helen H. Wu,2014
942,The Power of Our Words: Teacher Language That Helps Children Learn,Paula Denton,2007
943,"Tooty the Tiger: Short Stories, Coloring Book, and Jokes!",Uncle Amon,2015
944,I Remember Nothing More: The Warsaw Children's Hospital and the Jewish Resistance,Adina Blady Szwajger,1992
945,The Children’s House,Alice Nelson,-1
946,"The Gymnastics Mystery (The Boxcar Children, #73)",Gertrude Chandler Warner,1999
947,"Dumbing Down Our Kids: Why American Children Feel Good About Themselves But Can't Read, Write or Add",Charles J. Sykes,1995
948,What Your Doctor May Not Tell You About Children's Vaccinations,Stephanie Cave,2001
949,"Children of the Sea, Volume 3 (Children of the Sea, #3)",Daisuke Igarashi,2007
950,"Knight of the Flame (Children of the Old War, #1)",H. John Spriggs,2014
951,A Circle of Children,Mary MacCracken,1974
952,After the Battle on Starship Hill: Prologue to The Children of the Sky,Vernor Vinge,2011
953,Children of the Blessing (The Lemurian Chronicles #1),Perry Morris,2015
954,"Barkus: Book 1 (Children's Books about Dogs, Picture Books for Dog Lovers)",Patricia MacLachlan,2017
955,The Children of Lir (Ireland's Best Known Stories in a Nutshell Book 1),Ann Carroll,2012
956,"From the Mouth of Elijah (Children of the Bard, #2)",Bryan Davis,2012
957,Homeschooling Our Children Unschooling Ourselves,Alison McKee,2002
958,The Hundred Languages of Children: The Reggio Emilia Approach Advanced Reflections,Carolyn Edwards,1993
959,"The Blackgod (Children of the Changeling, #2)",Greg Keyes,1997
960,"Evolution (Children of the After, #3)",Jeremy Laszlo,2014
961,Children of God Go Bowling,Shannon Olson,2004
962,Molave and the Orchid and Other Children's Stories,F. Sionil José,2004
963,Sleep My Darlings: The True Story of a Mother Who Killed Her Children in Cold Blood,Diane Fanning,2013
964,"Children of Hope (Seafort Saga, #7)",David Feintuch,2001
965,The Einstein Syndrome: Bright Children Who Talk Late,Thomas Sowell,1963
966,"The Mystery in the Old Attic (The Boxcar Children Special, #9)",Gertrude Chandler Warner,1997
967,"Celtic Tales, Told to the Children",Louey Chisholm,1910
968,"The Movie Star Mystery (The Boxcar Children, #69)",Gertrude Chandler Warner,1948
969,"Into Darkness (Children of D'Hara, #5)",Terry Goodkind,2020
970,Ecological Literacy: Educating Our Children for a Sustainable World,Michael K. Stone,1991
971,The Enneagram of Parenting: The 9 Types of Children and How to Raise Them Successfully,Elizabeth Wagele,1997
972,"The Awakened Family: How to Raise Empowered, Resilient, and Conscious Children",Shefali Tsabary,-1
973,Discovering Great Artists: Hands-On Art for Children in the Styles of the Great Masters,MaryAnn F. Kohl,1997
974,"Deep Nutrition: How Traditional Foods Unlock Your Genetic Potential to Lose Weight, Sharpen Your Mind, Improve Energy, Look and Feel Younger, and Ensure the Health of Your Children",Catherine Shanahan,2008
975,"No More Christian Nice Guy: When Being Nice--Instead of Good--Hurts Men, Women and Children",Paul Coughlin,2005
976,Adult Children: The Secrets of Dysfunctional Families,John C. Friel,1988
977,The Fate (Children of Wisdom #1),Stephanie Erickson,2015
978,The Castoff Children,L.M. Browning,-1
979,"The Road to Rebirth (The Children of Telm, #2)",Dean F. Wilson,2014
980,Walking on Eggshells: Navigating the Delicate Relationship Between Adult Children and Parents,Jane Isay,2007
981,"The Great Bicycle Race Mystery (The Boxcar Children, #76)",Gertrude Chandler Warner,2000
982,Children's stories with a moral by Sergey Nikolov,Sergey Nikolov,2014
983,"The Secret of Happy Children: Why Children Behave the Way They Do--and What You Can Do to Help Them to Be Optimistic, Loving, Capable, and Happy",Steve Biddulph,1985
984,Six Plays: The Children's Hour / Days to Come / The Little Foxes / Watch on the Rhine / Another Part of the Forest / The Autumn Garden,Lillian Hellman,1934
985,"Sweet Sleep (Children of Ankh, #1 )",Kim Cormack,2014
986,The Myth of the Spoiled Child: Challenging the Conventional Wisdom About Children and Parenting,Alfie Kohn,2014
987,"Wonder Woman, Volume 6: Children of the Gods",James Robinson,2018
988,Neptune's Children,Bonnie Dobkin,2008
989,"The Mystery of the Midnight Dog (The Boxcar Children, #81)",Gertrude Chandler Warner,2001
990,What Do You Buy the Children of the Terrorist Who Tried to Kill Your Wife?: A Memoir,David Harris-Gershon,2013
991,Psychic Children: Revealing the Intuitive Gifts and Hidden Abilities of Boys and Girls,Sylvia Browne,2007
992,The Most Important Year: Pre-Kindergarten and the Future of Our Children,Suzanne Bouffard,-1
993,"Midnight Falls (Children of the Goddess, #4)",R.G. Alexander,2009
994,Why Knowledge Matters: Rescuing Our Children from Failed Educational Theories,E.D. Hirsch,-1
995,Four Fantastic Bedtime Stories for Children 3-6,Scott  Gordon,2012
996,36 Children,Herbert R. Kohl,1968
997,5 Minute Bedtime Stories for Children Vol.2 (Classic Fairy Tales & Bedtime Stories Collections for kids ages 6-12),Beatrice Wood,2015
998,"New Treasure Seekers (Bastable Children, #3)",E. Nesbit,1904
999,St. Blair: Children of the Night,Emily W. Skinner,2013
1000,Children of the Earth (End Times #2),Anna Schumacher,2015
1001,"The Pilgrim Village Mystery (The Boxcar Children Special, #5)",Gertrude Chandler Warner,1995
1002,"The Midnight Mystery (The Boxcar Children, #95)",Gertrude Chandler Warner,2003
1003,The Best of Laugh Yourself Silly Jokes for Kids Sampler: Children's Juvenile Humor Ages 6-14 Riddles Knock-Knock Jokes,H.A. Riddle,-1
1004,Children of the Country,Abigail R. Shaffer,-1
1005,The Care and Feeding of Indigo Children,Doreen Virtue,2001
1006,RJ - Boy Detective #1: The Mysterious Crate (a fun short story mystery for children ages 9-12),P.J. Ryan,2013
1007,Children of the Salt Road,Lydia Fazio Theys,-1
1008,"The Children of the Red King, Books 1-5: Midnight for Charlie Bone, Charlie Bone and the Time Twister, Charlie Bone and the Invisible Boy, Charlie Bone and the Castle of Mirrors, and Charlie Bone and the Hidden King",Jenny Nimmo,2006
1009,"The Tattletale Mystery (The Boxcar Children, #92)",Gertrude Chandler Warner,2003
1010,Illustrating Children's Books: Creating Pictures for Publication,Martin Salisbury,2004
1011,Socialized to Rebel: Changing the Course of America's Children and Youth,Christina Christian,-1
1012,Children on the Oregon Trail,An Rutgers van der Loeff,1954
1013,The Heart of Anger: Practical Help for Prevention and Cure of Anger in Children,Lou Priolo,1998
1014,The Wolf and the Raven (Wodan's Children #1),Diana L. Paxson,1993
1015,"Growing Up Mindful: Essential Practices to Help Children, Teens, and Families Find Balance, Calm, and Resilience",Christopher   Willard,2016
1016,Bringing Metal to the Children: The Complete Berserker's Guide to World Tour Domination,Zakk Wylde,2011
1017,"Parenting, Inc.: How the Billion-Dollar Baby Business Has Changed the Way We Raise Our Children",Pamela Paul,2008
1018,Dear Pope Francis: The Pope Answers Letters from Children Around the World,Pope Francis,2016
1019,"The Honeybee That Learned to Dance: A Children's Nature Picture Book, a Fun Honeybee Story That Kids Will Love;",Sharon  Clark,-1
1020,Celebrating the Great Mother: A Handbook of Earth-Honoring Activities for Parents and Children,Cait Johnson,1995
1021,It Takes Two to Talk: A Practical Guide for Parents of Children With Language Delays,Jan Pepper,2004
1022,"The Mystery in the Computer Game (The Boxcar Children, #78)",Gertrude Chandler Warner,2000
1023,Wednesday's Children: The Memoirs of a Nurse-Turned-Social-Worker in Rural Appalachia,Kathryn Anne Michaels,-1
1024,"The Mystery of the Star Ruby (The Boxcar Children, #89)",Gertrude Chandler Warner,2002
1025,Welding with Children,Tim Gautreaux,1999
1026,So Many Children,Anne Baker,2002
1027,"Buzz the Bumblebee: Stories, Games, Jokes, and More!",Uncle Amon,2015
1028,"The Children Of The Gods; Mega Boxset 1 (The Children Of The Gods, #1 To #6)",I.T. Lucas,-1
1029,An Echo of Earth (Children of Earthrise Book 3),Daniel Arenson,-1
1030,"Aflausn (Children's House, #3)",Yrsa Sigurðardóttir,2016
1031,Children Learn What They Live,Dorothy Law Nolte,1998
1032,"The Mystery of the Lake Monster (The Boxcar Children, #62)",Gertrude Chandler Warner,1998
1033,"The Mystery at the Crooked House (The Boxcar Children, #79)",Gertrude Chandler Warner,2000
1034,The Mystery in Washington D.C. (Boxcar Children Mystery & Activities Specials #2),Gertrude Chandler Warner,1994
1035,Children of Lovecraft,Ellen Datlow,2016
1036,All God's Children and Blue Suede Shoes: Christians and Popular Culture,Kenneth A. Myers,1989
1037,Children are Diamonds,Edward Hoagland,2013
1038,"Demon Bait (Children of the Undying, #0.5)",Moira Rogers,2011
1039,Teaching Your Children Joy,Linda Eyre,1980
1040,Children of No One,Nicole Cushing,2013
1041,"The Saeshell Book of Time, Part 1: The Death of Innocents (Children of Sophista, #1)",Rusty A. Biesele,2012
1042,"Easter Bunny: Stories, Jokes, Games, and More!",Uncle Amon,2015
1043,The Court of the Stone Children,Eleanor Cameron,1973
1044,"Feeding the Whole Family: Whole Foods Recipes for Babies, Young Children, and Their Parents",Cynthia Lair,1994
1045,Are We There Yet? 36 Eye-Rolling Flowcharts from the Wonderfully Weird Brains of Children,David Vienna,-1
1046,"I'm Chocolate, You're Vanilla: Raising Healthy Black and Biracial Children in a Race-Conscious World",Marguerite A. Wright,1998
1047,"Naturally Healthy Babies and Children: A Commonsense Guide to Herbal Remedies, Nutrition, and Health",Aviva Romm,1996
1048,Little Victim: Britain's Vulnerable Children and the Cops Who Rescue Them,Harry Keeble,2011
1049,"The Mystery of the Empty Safe (The Boxcar Children, #75)",Gertrude Chandler Warner,2000
1050,Planets And Moons In Our Universe: Children's Books and Bedtime Stories For Kids Ages 3-8 for Fun Life Lessons (Books For Kids Series),Speedy Publishing,2014
1051,"The Ice Cream Mystery (The Boxcar Children, #94)",Gertrude Chandler Warner,2003
1052,The Family Virtues Guide: Simple Ways to Bring Out the Best in Our Children and Ourselves,Linda Kavelin Popov,1997
1053,"The Stuffed Bear Mystery (The Boxcar Children, #90)",Gertrude Chandler Warner,2002
1054,Equinox (Children of Occam #2),Christian Cantrell,2015
1055,Ghost Children,Sue Townsend,1997
1056,The Satin Man: Uncovering the mystery of the missing Beaumont children,Alan Whiticker,2013
1057,Lying to Children,Alex Shahla,-1
1058,Escape from Children's Hospital,Jonathan Safran Foer,2014
1059,Children of War,Deborah Ellis,2009
1060,The Children of Manor House,R.A. Douthitt,2016
1061,"Libba: The Magnificent Musical Life of Elizabeth Cotten (Early Elementary Story Books, Children's Music Books, Biography Books for Kids)",Laura Veirs,2018
1062,The Importance of Being Little: What Young Children Really Need from Grownups,Erika Christakis,2016
1063,How to Write a Children's Book,Katie Davis,-1
1064,Silly Riddles for Silly Kids: Children's Riddle Book Ages 5-12,Silly Willy,2015
1065,"The Black Pearl Mystery (The Boxcar Children, #64)",Gertrude Chandler Warner,1998
1066,"The New Social Story Book: Over 150 Social Stories that Teach Everyday Social Skills to Children with Autism or Asperger's Syndrome, and Their Peers",Carol Gray,1997
1067,White Wild Indigo: An Illustrated Collection of Poems for Children,Jet Widick,-1
1068,Books For Kids: Little Cats Eww And Yuck: Stinky Kittens (Little Cats Eww And Yuck - Children's Books Book 2),Ekaterina Chernova,-1
1069,Freedom's Children: Young Civil Rights Activists Tell Their Own Stories,Ellen Levine,1993
1070,"Mindful Games: Sharing Mindfulness and Meditation with Children, Teens, and Families",Susan Kaiser Greenland,-1
1071,Three Wishes: Palestinian and Israeli Children Speak,Deborah Ellis,2004
1072,The Mystery of the Mummy's Curse (The Boxcar Children #88),Gertrude Chandler Warner,2002
1073,Stupid Children,Lenore Zion,2013
1074,"Angel of Death:  A Love Story (Children of the Fallen, #1)",Anna Erishkigal,2013
1075,Gospills: A Daily Dose of God's Medicine for His Children,Jeff         Johnson,-1
1076,Windows to Our Children,Violet Oaklander,1978
1077,Parenting Children with ADHD: 10 Lessons That Medicine Cannot Teach,Vincent J. Monastra,2004
1078,1-2-3 Magic for Christian Parents: Effective Discipline for Children 2-12,Thomas W. Phelan,2004
1079,A Still Quiet Place: A Mindfulness Program for Teaching Children and Adolescents to Ease Stress and Difficult Emotions,Amy Saltzman,2013
1080,"Gender Born, Gender Made: Raising Healthy Gender-Nonconforming Children",Diane Ehrensaft,2011
1081,"Dreaming Dangerously (Children of the Psi, #1)",Kathleen Harsch,2011
1082,The Secret Power of Middle Children: How Middleborns Can Harness Their Unexpected and RemarkableAbilities,Catherine Salmon,2011
1083,The Spiritual Life of Children,Robert Coles,1990
1084,"Speedpost: Letters to My Children about Living, Loving, Caring and Coping with the World",Shobhaa Dé,1999
1085,Children Book: I Wish I Were an Elephant: Kid's Photo Book with Fun Facts (Ages 3-7) (Bedtime Story),Jean Matee,2014
1086,Sky Lantern: The Story of a Father's Love for His Children and the Healing Power of the Smallest Act of Kindness,Matt Mikalatos,2015
1087,"The Mystery of the Secret Message (The Boxcar Children, #55)",Gertrude Chandler Warner,1996
1088,"Mindful Parenting for ADHD: A Guide to Cultivating Calm, Reducing Stress, and Helping Children Thrive",Mark Bertin,2015
1089,Survivors of the Holocaust: True Stories of Six Extraordinary Children,Kath Shackleton,-1
1090,Beyond Behaviors: Using Brain Science and Compassion to Understand and Solve Children's Behavioral Challenges,Mona Delahooke,-1
1091,Many Ways to Say I Love You: Wisdom for Parents and Children from Mister Rogers,Fred Rogers,2006
1092,Silently Seduced: When Parents Make Their Children Partners - Understanding Covert Incest,Kenneth M. Adams,1991
1093,Why Our Children Will Be Atheists,Albert  Williams,2013
1094,Rescuing the Children: The Story of the Kindertransport,Deborah Hodge,2012
1095,Parenting from the Inside Out: How a Deeper Self-Understanding Can Help You Raise Children Who Thrive,Daniel J. Siegel,2003
1096,Children of the Holocaust: Conversations with Sons and Daughters of Survivors,Helen Epstein,1979
1097,The Princess and the Fog: A Story for Children with Depression,Lloyd      Jones,2015
1098,"Yes, We Can! A Salute To Children From President Obama's Victory Speech",Barack Obama,-1
1099,Hooked: New Science on How Casual Sex is Affecting Our Children,Freda McKissic Bush,2008
1100,Diary of a Time Spy (An hilarious adventure for children aged 9-12) (Diary of a Sixth Grade Time Spy),Peter Patrick,-1
1101,"Empty Hands, A Memoir: One Woman's Journey to Save Children Orphaned by AIDS in South Africa",Abegail Ntleko,2015
1102,The Devil You Know (Children of the Mountain #2),R.A. Hakok,-1
1103,Creative Children Like the Animals of the World,Michelle Korenfeld,2014
1104,The Disciple-Making Parent: A Comprehensive Guidebook for Raising Your Children to Love and Follow Jesus Christ,Chap Bettis,2016
1105,The Knowledge Deficit: Closing the Shocking Education Gap for American Children,E.D. Hirsch Jr.,2006
1106,Love Poems for People with Children,John Kenney,2019
1107,"Darwin's Children (Darwin's Children, #1)",Natasha Larry,2010
1108,Voices from the Second World War: Stories of War as Told to Children of Today,Candlewick Press,-1
1109,Go to work and do your job. Care for your children. Pay your bills. Obey the law. Buy products.,Noah Cicero,2013
1110,Right-Brained Children in a Left-Brained World: Unlocking the Potential of Your ADD Child,Jeffrey Freed,1997
1111,Suffer The Little Children,Barbara Davis,1999
1112,Thursday's Children,Rumer Godden,1984
1113,"The Mystery of the Blizzard Mountain (The Boxcar Children, #86)",Gertrude Chandler Warner,2002
1114,Children of the Knight,Michael J.  Bowler,2013
1115,Unregistered (Children of the Uprising #1),M.   Lynch,-1
1116,Lunch Lessons: Changing the Way We Feed Our Children,Ann Cooper,2006
1117,The Highly Intuitive Child: A Guide to Understanding and Parenting Unusually Sensitive and Empathic Children,Catherine Crawford,2008
1118,Building Better Families: A Practical Guide to Raising Amazing Children,Matthew Kelly,2008
1119,Everyday Talk: Talking Freely and Naturally about God with Your Children,John A. Younts,2005
1120,In the Beginning: God's Word for God's Children (The KathIrene Kids Bible Series Book 1),Olin Edward James,2014
1121,"Hope Against Hope: Three Schools, One City, and the Struggle to Educate America’s Children",Sarah  Carr,2013
1122,Maybe Days: A Book for Children in Foster Care,Jennifer Wilgocki,2001
1123,The Best Part of Me: Children Talk About Their Bodies in Pictures and Words,Wendy Ewald,2002
1124,Irena Sendler: Mother of the Children of the Holocaust,Anna Mieszkowska,2005
1125,"Children of a Broken Sky (The Redemption Chronicle, #1)",Adam J. Nicolai,2013
1126,What Do You Really Want for Your Children?,Wayne W. Dyer,1985
1127,Children of the Longhouse,Joseph Bruchac,1996
1128,Parenting in the pew : guiding your children into the joy of worship,Robbie Castleman,1993
1129,The Coconut Children,Vivian Pham,-1
1130,The Wild Children,Felice Holman,1983
1131,The Writer's Guide to Crafting Stories for Children,Nancy Lamb,2001
1132,The Five Shilling Children,Lindsey Hutchinson,-1
1133,Be the Hands and Feet: Living Out God's Love for All His Children,Nick Vujicic,2018
1134,Six Million Paper Clips: The Making of a Children's Holocaust Memorial,Peter W. Schroeder,2004
1135,The Chosen (Children of the Prime #1),T.C. Edge,-1
1136,Children Who Remember Previous Lives: A Question of Reincarnation,Ian Stevenson,1987
1137,"Children of Chaos (Dodec, #1)",Dave Duncan,2006
1138,How to Get Your Children to Clean Their Rooms Using Rubric Rules: A Teacher's Strategy,Katie Ely,2015
1139,Suffer The Little Children: The True Story of an Abused Convent Upbringing,Frances Reilly,2010
1140,Lightning Child (Children of the Mountain #3),R.A. Hakok,-1
1141,Transforming Children Into Spiritual Champions: Why Children Should Be Your Church's #1 Priority,George Barna,2003
1142,Children of the Sun,Max Schaefer,2010
1143,"The Vanishing Passenger (The Boxcar Children, #106)",Gertrude Chandler Warner,2006
1144,"The Candy Factory Mystery (The Boxcar Children Special, #18)",Gertrude Chandler Warner,2002
1145,Jade's Life Skills Series - Learning Manners or To Fart Or Not To Fart (Children's Life Skills Series),Asaf Shani,2013
1146,Keeping Secrets (Children of the Light #1),Donna Hechler Porter,2014
1147,Elijah in Jerusalem (Children of the Last Days #7),Michael D. O'Brien,2015
1148,Portraits of His Children,George R.R. Martin,1985
1149,The Arrow (Children of Brigid Trilogy Book #1),Maureen O'Leary,2014
1150,The Origins of Intelligence in Children,Jean Piaget,1936
1151,Mega Collection #1: Nine Awesome Bedtime Stories for Children 3-6!,Scott  Gordon,2012
1152,More Than Words: Helping Parents Promote Communication and Social Skills in Children with Autism Spectrum Disorder,Fern Sussman,1999
1153,"Black Sun Light My Way (Children of the Black Sun, #2)",Jo Spurrier,2013
1154,Someone cry for the children: The unsolved Girl Scout murders of Oklahoma and the case of Gene Leroy Hart,Michael Wilkerson,1981
1155,Time's Children,D.B. Jackson,2018
1156,Setting Boundaries with Your Adult Children: Six Steps to Hope and Healing for Struggling Parents,Allison Bottke,2008
1157,How Children Raise Parents: The Art of Listening to Your Family,Dan B. Allender,1900
1158,"Number Talks, Grades K-5: Helping Children Build Mental Math and Computation Strategies",Sherry Parrish,2010
1159,A Fun Day at the Countryside: Children's book (Bedtime stories book series for children 5),N.S. Esther,-1
1160,"Moo Moo the Happy Cow: Stories, Jokes, Games, and More!",Uncle Amon,2015
1161,The Learning Habit: A Groundbreaking Approach to Homework and Parenting that Helps Our Children Succeed in School and Life,Stephanie Donaldson-Pressman,2014
1162,"Mystery of the Fortune Cookie (The Boxcar Children, #96)",Gertrude Chandler Warner,2003
1163,"The Little Leprechaun Who Loved Yellow! (Happy Children's Series, #2)",Sally Huss,2013
1164,Children of Crisis: Selections from the Pulitzer Prize-winning five-volume Children of Crisis series,Robert Coles,1967
1165,Bible For Kids: A Collection of Bible Stories for Children Complete (Over 60 Illustrated) (With Over 100 Fun-Filled Follow-Up Activities),Fiona Wesley,2014
1166,Lifeskills for Adult Children,Janet Geringer Woititz,1990
1167,Parents and Children (Original Homeschooling #2),Charlotte M. Mason,1897
1168,When Dad Hurts Mom: Helping Your Children Heal the Wounds of Witnessing Abuse,Lundy Bancroft,2004
1169,This Is the Way We Go to School: A Book About Children Around the World,Edith Baer,1990
1170,Calm and Compassionate Children: A Handbook,Susan Usha Dermond,2007
1171,Children of the Elementi,Ceri Clark,2010
1172,Pricing the Priceless Child: The Changing Social Value of Children,Viviana A. Zelizer,1994
1173,Hardly Children: Stories,Laura Adamczyk,2018
1174,Minecraft Kid's Stories Book: A Collection of Marvelous Minecraft Short Stories for Children: Amusing Minecraft Stories for Kids from Famous Children Authors. A Treasure for All Little Minecrafters!,Minecraft Books,2014
1175,"The Spy Game (The Boxcar Children, #118)",Gertrude Chandler Warner,2009
1176,"The Mystery of the Orphan Train (Boxcar Children, #105)",Gertrude Chandler Warner,2005
1177,"Keep Calm And Carry On, Children",Sharon K. Mayhew,-1
1178,How to Talk So Your Kids Will Listen: From Toddlers to Teenagers: Connecting with Your Children at Every Age,H. Norman Wright,2004
1179,The Secret Children,Alison   McQueen,2012
1180,The Verbal Behavior Approach: How to Teach Children with Autism and Related Disorders,Mary Barbera,2007
1181,"The Radio Mystery (The Boxcar Children, #97)",Gertrude Chandler Warner,2003
1182,"Sleep, My Child, Forever: The Riveting True Story of a Mother Who Murdered Her Own Children",John Coston,1995
1183,Children Of Light,Robert  Stone,1985
1184,"The Mammoth Hunters, Part 1 of 2 (Earth's Children, #3)",Jean M. Auel,1985
1185,The Children's War,J.N. Stroyar,2001
1186,"The Clue In The Corn Maze (The Boxcar Children, #101)",Gertrude Chandler Warner,2004
1187,Children and Lunatics,Megan McNamer,-1
1188,"Children of the Sea, Volume 4 (Children of the Sea, #4)",Daisuke Igarashi,2007
1189,"Our Children Can Soar: A Celebration of Rosa, Barack, and the Pioneers of Change",Michelle Cook,2009
1190,"Trident's Forge (Children of a Dead Earth, #2)",Patrick S. Tomlinson,2016
1191,"Golden Legacy: How Golden Books Won Children's Hearts, Changed Publishing Forever, and Became An American Icon Along the Way",Leonard S. Marcus,2007
1192,"Suffer the Little Children (The Chronicles of Christoval Alvarez, #5)",Ann Swinfen,2015
1193,The Children of Gavrilek,Julie Kirton Chandler,2013
1194,Show and Tell: Exploring the Fine Art of Children's Book Illustration,Dilys Evans,2008
1195,"The Box That Watch Found (The Boxcar Children, #113)",Gertrude Chandler Warner,2007
1196,"The Seventh Door (Children of the Bard, #3)",Bryan Davis,2014
1197,"The Comic Book Mystery (The Boxcar Children, #93)",Gertrude Chandler Warner,2003
1198,Show Me a Story: 40 Craft Projects and Activities to Spark Children's Storytelling,Emily K. Neuburger,2012
1199,The Children Star,Joan Slonczewski,1998
1200,Resilience Parenting: Raising Resilient Children in an Era of Detachment and Dependence,Chris Santillo,-1
1201,The Children Under the Ice,R.A. Douthitt,2014
1202,Baby Animals from Africa: A rhyming picture book for children aged 0-5,Barb Asselin,2014
1203,"Terry Brooks CD Collection: Armageddon's Children, The Elves of Cintra",Terry Brooks,2010
1204,"The Mystery in New York (The Boxcar Children Special, #13)",Gertrude Chandler Warner,1999
1205,Witnesses of War: Children's Lives Under the Nazis,Nicholas Stargardt,2005
1206,Gideon's Children,Howard G. Franklin,2014
1207,"The Creature in Ogopogo Lake (The Boxcar Children, #108)",Gertrude Chandler Warner,2006
1208,A Book of Dog Breeds For Children: They're All Dogs,Amber Richards,2013
1209,"Children of Anubis (Supernatural, #17)",Tim Waggoner,-1
1210,The Children Who Loved Books,Peter Carnavas,2012
1211,Born to Rise: A Story of Children and Teachers Reaching Their Highest Potential,Deborah Kenny,2012
1212,The War for Earth (Children of Earthrise Book 4),Daniel Arenson,-1
1213,"The Mystery at the Ballpark (Boxcar Children Special, #4)",Gertrude Chandler Warner,1995
