,Title,Authors,Year
1214,"Frenchmen, Desire, Good Children: . . . and Other Streets of New Orleans!",John Churchill Chase,1979
1215,Motherless Children,Randall Luce,2011
1216,A Country Called Childhood: Children and the Exuberant World,Jay Griffiths,2013
1217,Chivalry's Children,Alexis P. Johnson,-1
1218,The Healing Power of Play: Working with Abused Children,Eliana Gil,1991
1219,Silent Children,Ramsey Campbell,2000
1220,"Vaccine Epidemic: How Corporate Greed, Biased Science, and Coercive Government Threaten Our Human Rights, Our Health, and Our Children",Louise Kuo Habakus,2011
1221,Saiqa (The Children of the Stars #1),A.L. Whyte,-1
1222,When Invisible Children Sing,Chi Cheng Huang,2006
1223,Birth Control Is Sinful in the Christian Marriages and Also Robbing God of Priesthood Children!!,Eliyzabeth Yanne Strong-Anderson,2007
1224,Harry and the Hot Lava (Xist Children's Books),Chris   Robertson,2014
1225,Christmas Joke Book for Children: Funny Christmas Jokes for Kids (Christmas Joke Books for Kids),Johnny B. Laughing,2014
1226,Ducky Duck (Early Readers Children's Book Edition with 1st Grade Site Words),Jenny Loveless,2013
1227,"Teaching Children to Care: Classroom Management for Ethical and Academic Growth, K-8",Ruth Sidney Charney,1992
1228,Outgrowing the Pain: A Book for and about Adults Abused as Children,Eliana Gil,1983
1229,"The Game Store Mystery (The Boxcar Children, #104)",Gertrude Chandler Warner,2005
1230,"The King of Trees: Three Novellas: The King of Trees, The King of Chess, The King of Children",Ah Cheng,1990
1231,"The Ghost Of The Chattering Bones (The Boxcar Children, #102)",Gertrude Chandler Warner,2005
1232,Scary Stories for Kids - Short Horror Stories for Children: (Children's Books and Books for Kids),Kara Aitken,2014
1233,10 Conversations You Need to Have with Your Children,Shmuley Boteach,2006
1234,"Kids, Sex & Screens: Raising Strong, Resilient Children in the Sexualized Digital Age",Jillian Roberts,-1
1235,The Changeling Quest: Children of the Fae,Maria Moloney,2013
1236,The Grasshopper and the Ant: Aesop's Fables in Verses (Children's story picture books Book 3),Sigal Adler,-1
1237,"The Great Detective Race (The Boxcar Children, #115)",Gertrude Chandler Warner,2008
1238,"The Children of the Sun (II AM Trilogy, #3)",Christopher Buecheler,2012
1239,The Snowman's Children,Glen Hirshberg,2002
1240,Meaningful Differences in the Everyday Experience of Young American Children,Betty Hart,1995
1241,I Prayed For Patience: God Gave Me Children,Linda Wood Rondeau,2012
1242,"Bad Little Children's Books: KidLit Parodies, Shameless Spoofs, and Offensively Tweaked Covers",Arthur C. Gackley,-1
1243,Writing Children's Books for Dummies,Lisa Rojany Buccieri,2005
1244,"Rose, Where Did You Get That Red?: Teaching Great Poetry to Children",Kenneth Koch,1974
1245,Silly Facts for Silly Kids. Children's fact book age 5-12,Silly Willy,-1
1246,Poor Banished Children,Fiorella De Maria,2011
1247,The Widow's Children,Paula Fox,1976
1248,The Book of Children: Supporting the Freedom and Intelligence of a New Generation,Osho,1996
1249,"The Finders Keepers Mystery (The Boxcar Children, #99)",Gertrude Chandler Warner,2004
1250,Daedalus's Children (Star Trek: Enterprise #8),Dave Stern,2003
1251,Treating Trauma and Traumatic Grief in Children and Adolescents,Judith A. Cohen,2006
1252,A Cry of Stone (Children of the Last Days #6),Michael D. O'Brien,2003
1253,Wicked Children: Murderous Tales from History,Karen Maitland,-1
1254,The Graphic Canon of Children's Literature: The World's Great Kids' Lit as Comics and Visuals (The Graphic Canon),Russ Kick,2014
1255,The Belle and Boo Book of Crafts: 25 Enchanting Projects to Make for Children,Mandy Sutcliffe,2013
1256,Winter's Children,Leah Fleming,2010
1257,Early Birdy Gets the Worm (Picture Reader): A Picture Reading Book for Young Children,Bruce Lansky,2014
1258,What Are We Even Doing With Our Lives?: The Most Honest Children's Book of All Time,Chelsea Marshall,2017
1259,Dear Children of the Earth,Schim Schimmel,1994
1260,The Tale of Peter Rabbit Coloring Book: Beatrix Potter's Original Illustrations from the Classic Children's Story,Frankie Bow,-1
1261,The Pet Shop Mystery (Boxcar Children Special #7),Gertrude Chandler Warner,1996
1262,Attention Deficit Disorder: The Unfocused Mind in Children and Adults,Thomas E. Brown,2005
1263,"The Ghost in the First Row (The Boxcar Children, #112)",Gertrude Chandler Warner,2007
1264,The Water Children,Anne Berry,2011
1265,Children in Reindeer Woods,Kristín Ómarsdóttir,2004
1266,How to Make a Serial Killer: The Twisted Development of Innocent Children into the World's Most Sadistic Murderers,Christopher Berry-Dee,2008
1267,The Story of the Root Children,Sibylle von Olfers,1906
1268,"For the Inquiring Minds of Children, 100 Poems",Hal  Wilson,-1
1269,The Every Day Living of Children & Teens Monologues,Adra Young,2005
1270,Raising Respectful Children in a Disrespectful World,Jill Rigby,2006
1271,Suffer the Children (The Ghosts of RedRise House #3),Caroline   Clark,-1
1272,The Case Against Homework: How Homework Is Hurting Our Children and What We Can Do About It,Sara  Bennett,2006
1273,First German Reader for Beginners Bilingual for Children and Parents: Elementary with German-English translation,Elisabeth May,2014
1274,"A Bear Sat on My Porch Today: (Story Books for Kids, Childrens Books with Animals, Friendship Books, Inclusivity Book)",Jane Yolen,-1
1275,"Same Difference: How Gender Myths Are Hurting Our Relationships, Our Children, and Our Jobs",Rosalind C. Barnett,2004
1276,"Do You Believe in Magic? (Children of Merlin, #1)",Susan Squires,2012
1277,Adventures in Cutie Patootie Land and The Pizza Party (an hilarious adventure for children ages 7-12),Starrie Sky,2013
1278,Smart Medicine for a Healthier Child: A Practical A-to-Z Reference to Natural and Conventional Treatments for Infants and Children,Janet Zand,1994
1279,"Dear Santa: Children's Christmas Letters and Wish Lists, 1870 - 1920",Chronicle Books,2015
1280,Children's Letters to a Holocaust Survivor: Dear Esther,Richard Rashke,2016
1281,Why Children Matter,Douglas Wilson,2018
1282,Christmas is coming! Wow! (children's christmas book series 1),Charles Obutte,2017
1283,The Cure: How a Father Raised $100 Million—and Bucked the Medical Establishment—in a Quest to Save His Children,Geeta Anand,2006
1284,"Wishes, Lies, and Dreams: Teaching Children to Write Poetry",Kenneth Koch,1970
1285,"The Gentle Parenting Book: How to raise calmer, happier children from birth to seven",Sarah Ockwell-Smith,-1
1286,"Love, Work, Children",Cheryl Mendelson,2005
1287,Poetry Speaks to Children (Book & CD),Elise Paschen,2005
1288,"Madeline: The most suitable for children, 100 books",Ludwig Bemelmans,1939
1289,Personal Space Camp: Teaching Children the Concepts of Personal Space,Julia Cook,2007
1290,"The Mystery of the Spider's Clue (The Boxcar Children, #87)",Gertrude Chandler Warner,2002
1291,Hitler's Children - Spitting Fire (Eyewitness Accounts - 12th SS Panzer 'Hitler Youth' in Normandy 1944),Sprech Media,2015
1292,The Child On Platform One: Inspired by the extraordinary true story of the children who escaped the Holocaust,Gill Thompson,-1
1293,Tears and Tantrums: What to Do When Babies and Children Cry,Aletha J. Solter,1998
1294,Children and Other Wild Animals,Brian  Doyle,2014
1295,The Trauma Myth: The Truth About the Sexual Abuse of Children--and Its Aftermath,Susan A. Clancy,2009
1296,"Girls Can Do Journal: A Daily Journal (Children's Journal Series, #5)",Karen Jean Matsko Hood,2014
1297,Children of the Mark,Michael W. Garza,2015
1298,The Lost Art of Feeding Kids: What Italy Taught Me about Why Children Need Real Food,Jeannie Marshall,2013
1299,Passion's Child (Texas: Children of Destiny #1),Ann Major,1988
1300,The Children Who Lived in a Barn,Eleanor Graham,1938
1301,The Children's Hour of Holidays,Patty   Smith,2013
1302,"Growing Up Again: Parenting Ourselves, Parenting Our Children",Jean Illsley Clarke,1996
1303,"Gatið (Children's House, #4)",Yrsa Sigurðardóttir,2017
1304,"A Horse Named Dragon (The Boxcar Children, #114)",Gertrude Chandler Warner,2008
1305,Children of the Dawnland,Kathleen O'Neal Gear,2003
1306,Lost Children of the Far Islands,Emily Raabe,2014
1307,Teaching Your Children Responsibility,Linda Eyre,1982
1308,"Infants, Children, and Adolescents",Laura E. Berk,1993
1309,Into the Minds of Babes: How Screen Time Affects Children From Birth to Age Five,Lisa Guernsey,2007
1310,Daughters of Chivalry: The Forgotten Children of Edward I,Kelcey Wilson-Lee,2019
1311,"Children No More (Jon & Lobo, #4)",Mark L. Van Name,2010
1312,Doing Life with Your Adult Children: Keep Your Mouth Shut and the Welcome Mat Out,Jim Burns,-1
1313,Avengers: The Children's Crusade #1,Allan Heinberg,2010
1314,All the Presidents' Children: Triumph and Tragedy in the Lives of America's First Families,Doug Wead,2003
1315,"The Saeshell Book of Time, Part 2: Rebirth of Innocents (Children of Sophista, #2)",Rusty A. Biesele,2013
1316,"The Mystery Of The Traveling Tomatoes (The Boxcar Children, #117)",Gertrude Chandler Warner,2008
1317,Banished Children of Eve:  A Novel of Civil War New York,Peter Quinn,2008
1318,Jefferson's Sons: A Founding Father's Secret Children,Kimberly Brubaker Bradley,2011
1319,"The Underdogs: Children, Dogs, and the Power of Unconditional Love",Melissa Fay Greene,2016
1320,"Dinosaur Joke Book for Kids: Funny & Hilarious Dinosaur Jokes for Kids, Early & Beginner Readers (Funny & Hilarious Joke Books for Children)",Johnny B. Laughing,2014
1321,"Eight Children and a Truck (Eight Children, #1)",Anne-Cath. Vestly,1957
1322,Children of the Sun: A History of Humanity's Unappeasable Appetite for Energy,Alfred W. Crosby,2006
1323,"Our White House: Looking In, Looking Out",National Children's Book & Literacy Alliance,2008
1324,"101 Games and Activities for Children with Autism, Asperger's and Sensory Processing Disorders",Tara Delaney,2009
1325,"Air: Merlin's Chalice (Children of Avalon, #1)",Meredith Bond,2004
1326,"Books For Kids: Be Careful Baby Bear!: Fun Stories, Children's Books, Free Stories, bedtime stories for kids, Series Books For Kids Ages 2-4, 4-6, 6-8, ... CHILDREN’S BEDTIME STORY BOOK SERIES BOOK)",Sheila Watkins,-1
1327,"The Rock 'n' Roll Mystery (The Boxcar Children, #109)",Gertrude Chandler Warner,2006
1328,"Omega Dragon (Children of the Bard, #4)",Bryan Davis,2015
1329,The Mystery at the Fair (Boxcar Children Mystery & Activities Specials #6) (Boxcar Children Special),Gertrude Chandler Warner,1996
1330,"The Dog-gone Mystery (The Boxcar Children, #119)",Gertrude Chandler Warner,2009
1331,Funny Books: Knock Knock Jokes for Kids - The Most Hilarious Kid-Tested (and Kid-Approved) Knock Knock Jokes for Children,Henry Baker,2013
1332,The Children of Now,Meg Blackburn Losey,2006
1333,Children of Neptune (Volume 1),Makenna Snow,-1
1334,Children of the Night: A Novel,T.C Paul,-1
1335,The Halloween Children,Brian James Freeman,2014
1336,Absent Children,Juli Townsend,2013
1337,"China's Hidden Children: Abandonment, Adoption, and the Human Costs of the One-Child Policy",Kay Ann Johnson,2016
1338,The Family Nutrition Book: Everything You Need to Know about Feeding Your Children from Birth Through Adolescence,William Sears,1999
1339,Toy Stories: Photos of Children from Around the World and Their Favorite Things,Gabriele Galimberti,2014
1340,"The Mystery of the Runaway Ghost (The Boxcar Children, #98)",Gertrude Chandler Warner,2004
1341,"Call Me Evil, Let Me Go: A Mother's Struggle to Save Her Children from a Brutal Religious Cult",Sarah Jones,2011
1342,Raising Adopted Children: Practical Reassuring Advice for Every Adoptive Parent,Lois Ruskai Melina,1986
1343,The Legacy of Earth (Children of Earthrise Book 6),Daniel Arenson,-1
1344,"Different Minds: Gifted Children with AD/HD, Asperger Syndrome, and Other Learning Deficits",Deirdre V. Lovecky,2003
1345,Raising Children Who Think for Themselves,Elisa Medhus,2001
1346,Once Upon A Wish: True Inspirational Stories of Make-A-Wish Children,Rachelle Sparks,2013
1347,"Lords of the Sea (Children of Andromeda, #1)",Kaitlyn O'Connor,2007
1348,Before I Go: Letters to Our Children about What Really Matters,Peter Kreeft,2007
1349,"The Amazing Mystery Show (The Boxcar Children, #123)",Gertrude Chandler Warner,2010
1350,If I Were A Robot (A fun picture book for children 3-6!),Scott  Gordon,2012
1351,"Children of Jubilee (Children of Exile, #3)",Margaret Peterson Haddix,2018
1352,The Return of the Marauders (The Omega Children #1),Shane A. Mason,2011
1353,"Because I Said So: 33 Mothers Write About Children, Sex, Men, Aging, Faith, Race, and Themselves",Kate Moses,2005
1354,"11X Magic: A Children's Picture Book That Makes Math Fun, With a Cartoon Rhyming Format to Help Kids See How Magical 11X Math Can Be",Sharon  Clark,-1
1355,The First R: How Children Learn Race and Racism,Debra Van Ausdale,2000
1356,"The Spy in the Bleachers (The Boxcar Children, #122)",Gertrude Chandler Warner,2010
1357,"Finding Home (Baxter Family Children, #2)",Karen Kingsbury,2020
1358,A Children's Illustrated History of Presidential Assassination,Bryan Young,2014
1359,Mama Maggie: The Untold Story of One Woman's Mission to Love the Forgotten Children of Egypt's Garbage Slums,Martin Makary,2015
1360,The Fire Children,Lauren M. Roy,2015
1361,"Mine!: (Read Aloud Books for Kids, Funny Children's Books)",Jeff Mack,2017
1362,"Your Child's Self-Esteem: Step-by-Step Guidelines for Raising Responsible, Productive, Happy Children",Dorothy Corkille Briggs,1975
1363,"Kiko the Kitty Cat: Short Stories, Games, Jokes, and More!",Uncle Amon,2015
1364,"Touching Heaven: Real Stories of Children, Life, and Eternity",Leanne Hadley,2013
1365,Children of the Broken Treaty: Canada's Lost Promise and One Girl's Dream,Charlie Angus,2015
1366,"The Heart Has Reasons: Dutch Rescuers of Jewish Children During the Holocaust, Updated Edition",Mark Klempner,2006
1367,Why Have Children?: The Ethical Debate,Christine Overall,2012
1368,"Wounded Children, Healing Homes: How Traumatized Children Impact Adoptive and Foster Families",Jayne E. Schooler,2005
1369,X-Men Epic Collection Vol. 1: Children of the Atom,Stan Lee,2015
1370,Building Emotional Intelligence: Techniques to Cultivate Inner Strength in Children [With CD],Linda Lantieri,2008
1371,The Oxford Illustrated Book of American Children's Poems,Donald Hall,1999
1372,Give Them Jesus: Raising Our Children on the Core Truths of the Christian Faith,Dillon T. Thornton,-1
1373,On Our Way to Oyster Bay: Mother Jones and Her March for Children's Rights,Monica Kulling,2016
1374,When The Children Came Home: Stories Of Wartime Evacuees,Julie Summers,2011
1375,Spare the Kids: Why Whupping Children Won't Save Black America,Stacey Patton,-1
1376,Children of the City,David Nasaw,1985
1377,"In Destiny's Hands: Five Tragic Rulers, Children of Maria Theresa",Justin C. Vovk,2009
1378,"Bringing Up Kids Without Tearing Them Down: How to Raise Confident, Successful Children",Kevin Leman,1993
1379,"The Cyber Effect: An Expert in Cyberpsychology Explains How Technology Is Shaping Our Children, Our Behavior, and Our Values--And What We Can Do about It",Mary Aiken,2016
1380,"Brúðan (Children's House, #5)",Yrsa Sigurðardóttir,-1
1381,"The Pumpkin Head Mystery (The Boxcar Children, #124)",Gertrude Chandler Warner,2010
1382,"The Cupcake Caper (The Boxcar Children, #125)",Gertrude Chandler Warner,2010
1383,We've Got Issues: Children and Parents in the Age of Medication,Judith Warner,2010
1384,Growing Up Global: Raising Children to Be At Home in the World,Homa Sabet Tavangar,2009
1385,"The Vampire Mystery (The Boxcar Children, #120)",Gertrude Chandler Warner,2009
1386,"The Secret of the Mask (The Boxcar Children, #110)",Gertrude Chandler Warner,2007
1387,The Art of Miss Peregrine's Home for Peculiar Children,Leah Gallo,-1
1388,"The Windy City Mystery (The Boxcar Children Special, #10)",Gertrude Chandler Warner,1998
1389,"The New Six-Point Plan for Raising Happy, Healthy Children",John Rosemond,1989
1390,31 Days of Praying God's Wisdom for My Children: Moms Gathering God's Valuable Wisdom from the Book of Proverbs and persistently covering Our Precious Children in Prayer,Hope McCardy,-1
1391,Something is Killing the Children Vol. 1,James Tynion IV,-1
1392,"Terraria: Diary of a Terraria Noob (Terraria Diaries, Terraria Books, Terraria Books for Children, Terraria Books for Kids, Terraria Stories, Terraria Noob)",Miner Bro,2015
1393,The Night Before Christmas: A Children's  Christmas Poem about the Birth of Jesus.,Merry Celeste Murray,2011
1394,The Undoing: The uncertain nights of the Peterson children,Gloria Watson,2014
1395,"The Forgotten Children (Don't Tell Meg Trilogy, #3)",Paul J. Teague,-1
1396,Children of the Night: Classic Vampire Stories,David Stuart Davies,2007
1397,A Nightmare on Elm Street: Suffer the Children,David Bishop,2005
1398,The Children of Castle Rock,Natasha Farrant,2018
1399,Vincent's Starry Night and Other Stories: A Children's History of Art,Michael Bird,2016
1400,Free the Children: A Young Man Fights Against Child Labor and Proves that Children Can Change the World,Craig Kielburger,1998
1401,Cruel World: The Children of Europe in the Nazi Web,Lynn H. Nicholas,2005
1402,Inherited Magick: The Children of Dark Root: Book One,April Aasheim,-1
1403,"Children of Thorns, Children of Water (Dominion of the Fallen, #1.5)",Aliette de Bodard,2017
1404,Children of the After: The Complete Series,Jeremy Laszlo,2014
1405,Awkward Moments (Not Found in Your Average) Children's Bible - Volume #1: Illustrating the Bible Like You've Never Seen Before!,Horus Gilgamesh,2013
1406,"Hammer Down (Children of the Undying, #1)",Moira Rogers,2012
1407,"365 Manners Kids Should Know: Games, Activities, and Other Fun Ways to Help Children Learn Etiquette",Sheryl Eberly,2001
1408,Those Dreadful Children,Enid Blyton,1949
1409,Diary of a Super Spy 4: Space! (An hilarious adventure for children aged 7 - 12),Peter Patrick,2015
1410,Babies for Sale: The Tennessee Children's Home Adoption Scandal,Linda Tollett Austin,1993
1411,Stories for Children,Isaac Bashevis Singer,1984
1412,The Garden Thief (The Boxcar Children Mysteries #130),Gertrude Chandler Warner,2012
1413,How Children Learn the Meanings of Words,Paul Bloom,2000
1414,"Superstar Watch (The Boxcar Children, #121)",Gertrude Chandler Warner,2009
1415,Loose Parts: Inspiring Play in Young Children,Lisa Daly,2014
1416,"Children of the Sea, Volume 5 (Children of the Sea, #5)",Daisuke Igarashi,2007
1417,The Norton Anthology of Children's Literature: The Traditions in English,Jack D. Zipes,2005
1418,You Are the Mother Your Children Need,Christie Gardiner,-1
1419,Theodore Roosevelt's Letters to His Children,Theodore Roosevelt,1919
1420,"North Star Guide Me Home (Children of the Black Sun, #3)",Jo Spurrier,2014
1421,"Thriving with ADHD Workbook for Kids: 60 Fun Activities to Help Children Self-Regulate, Focus, and Succeed",Kelli Miller LCSW MSW,-1
1422,"Deadmarsh Fey (Dwellers of Darkness, Children of Light #1)",Melika Dannese Hick,-1
1423,Elsie's Children (The Original Elsie Classics #6),Martha Finley,2000
1424,Praying Circles Around the Lives of Your Children,Mark Batterson,2014
1425,Children of the Dragon,Frank S. Robinson,1978
1426,Monkey Trouble (The Boxcar Children Mysteries #127),Gertrude Chandler Warner,2011
1427,Children of Another God,T.C. Southwell,2010
1428,Machiavelli for Moms: Maxims on the Effective Governance of Children*,Suzanne  Evans,2013
1429,Children's Literature: A Very Short Introduction,Kimberley Reynolds,2011
1430,Hannibal's Children,John Maddox Roberts,2002
1431,A Child's Book of Dog Body Language with Pictures: Help Keep Children Safe,Amber Richards,2013
1432,Wild Children,Richard  Roberts,2011
1433,The Children of Light and the Children of Darkness: A Vindication of Democracy and a Critique of its Traditional Defense,Reinhold Niebuhr,1950
1434,A Dog's Gift: The Inspirational Story of Veterans and Children Healed by Man's Best Friend,Bob Drury,2015
1435,Becoming a Present Parent: Connecting with Your Children in 5 Minutes or Less,Mary Ann   Johnson,-1
1436,Children’s Minds,Margaret Donaldson,1978
1437,Torpedoed!: A World War II Story of a Sinking Passenger Ship and Two Children's Survival at Sea,Cheryl Mullenbach,-1
1438,"The Clue in the Recycling Bin (The Boxcar Children, #126)",Gertrude Chandler Warner,2011
1439,Children of the Thunder,John Brunner,1988
1440,"Dear Parents: Letters from the Teacher—your children, their education, and how you can help",Gabbie Stroud,2020
1441,Alphabeti-cool: Children's painted ABC book,Rebecca Bielawski,2013
1442,Chicken Soup for the Soul: Children with Special Needs: Stories of Love and Understanding for Those Who Care for Children with Disabilities,Jack Canfield,2007
1443,"The Home Run Mystery (The Boxcar Children Special, #14)",Gertrude Chandler Warner,2000
1444,"Eternal Guardian (Children of the Goddess, #4.5)",R.G. Alexander,2011
1445,Collected Children's Stories,Sylvia Plath,2001
1446,Precious Angels: A True Story of Two Slain Children and a Mother Convicted of Murder,Barbara Davis,1999
1447,"I Wrote You a Note: (Children's Friendship Books, Animal Books for Kids, Rhyming Books for Kids)",Lizi Boyd,2017
1448,The Kindness of Strangers: The Abandonment of Children in Western Europe from Late Antiquity to the Renaissance,John Boswell,1988
1449,The Children's Machine: Rethinking School In The Age Of The Computer,Seymour Papert,1993
1450,"Stabbed in the Heart: Three Murdered Children, Two Resilient Mothers",Lynn Shiner,2013
1451,"Kids for Cash: Two Judges, Thousands of Children, and a $2.6 Million Kickback Scheme",William Ecenbarger,2012
1452,"I’m a Dragon Today: Sometime parents can be ""creative"" too! (Bedtimes Story Fiction Children's Picture Book Book 3)",Sigal Adler,2018
1453,The Merman's Children,Poul Anderson,1979
1454,King Arthur and His Knights,James Knowles,1860
1455,"Children of Bacchus (Satyr, #1)",Andrew  Grey,2008
1456,Should We Burn Babar?: Essays on Children's Literature and the Power of Stories,Herbert R. Kohl,1995
1457,Extinction of All Children,L.J. Epps,2016
1458,"The Temperament God Gave Your Kids: Motivate, Discipline, and Love Your Children",Art Bennett,2012
1459,Black Eyed Children (Black Eyed Children #1),Sara Clancy,2017
1460,"Children of Sun and Moon (Skyfall, #1)",Matt Larkin,2012
1461,Literacy with an Attitude: Educating Working-Class Children in Their Own Self-Interest,Patrick J. Finn,1999
1462,The Golden Children's Bible,Anonymous,1962
1463,"Theodora's Children (Tales of Hope, #2)",Rick Nau,-1
1464,How To Raise Emotionally Healthy Children: Meeting The Five Critical Needs of Children...and Parents Too! Updated Edition [Kindle Edition],Gerald Newmark,1999
1465,Four More Fantastic Bedtime Stories for Children 3-6 (Four Fantastic Bedtime Stories Book 2),Scott  Gordon,2012
1466,The Devil's Children,Peter Dickinson,1970
1467,Many Ways to See the Sun: Nature Meditation for Children and the Adults Who Love Them,Brooke Dierkhising,2015
1468,From Diapers to Dating: A Parent's Guide to Raising Sexually Healthy Children,Debra W. Haffner,1999
1469,Across Time And Death: A Mother's Search For Her Past Life Children,Jenny Cockell,1994
1470,Children of the Lost (The Agora Trilogy #2),David Whitley,2010
1471,"Kagerou Daze, Vol. 3: The Children Reason (Kagerou Daze Light Novels, #3)",Jin (Shizen no Teki-P),2013
1472,The Gender Creative Child: Pathways for Nurturing and Supporting Children Who Live Outside Gender Boxes,Diane Ehrensaft,2016
1473,"The Ghost at the Drive-In Movie (The Boxcar Children, #116)",Gertrude Chandler Warner,2008
1474,Educating All God’s Children: What Christians Can--and Should--Do to Improve Public Education for Low-Income Kids,Nicole Baker Fulgham,2013
1475,"This Star Shall Abide (Children of the Star, #1)",Sylvia Engdahl,1972
1476,"Raising America: Experts, Parents, and a Century of Advice About Children",Ann Hulbert,2003
1477,"Ashlynn's Dreams (Devya's Children, #1)",Julie C. Gilbert,2010
1478,Global Baby Girls,Global Fund for Children,2013
1479,Children of Morrow,Helen Mary Hoover,1985
1480,The Children's Book of Christmas Stories,Asa Don Dickinson,1913
1481,Trial of the Chosen (Children of the Prime #2),T.C. Edge,-1
1482,"The Boardwalk Mystery (The Boxcar Children, #131)",Gertrude Chandler Warner,2013
1483,Are You My Wine?: A Children's Book Parody for Adults Exploring the World of Wine,Reese Ling,-1
1484,All My Stripes: A Story for Children with Autism,Shaina Rudolph,2015
1485,The Energetic Keys to Indigo Kids: Your Guide to Raising and Resonating With the New Children,Maureen  Healy,2013
1486,Children of the Comet,Donald Moffitt,2015
1487,Pomodoro Penguin Makes a Friend: a picture book for children ages 4-6 about friendship and respect (The Adventures of Pomodoro Penguin Children's Early Learning Book for Beginning Readers 1),Bryce Westervelt,2013
1488,Dr. Doolittle (Original Illustrations & Text) (Classic Books for Children),Hugh Lofting,1920
1489,The Lost Flower Children,Janet Taylor Lisle,1999
1490,Children Of Tomorrow,A.E. van Vogt,1970
1491,The Lost Children (Oonagh O'Neil #1),Theresa Talbot,-1
1492,Falcondell: The Devil's Son (The Devil's Children #1),S.J. Crabb,-1
1493,"The Clan of the Cave Bear, Part 2 of 2 (Earth's Children, #1)",Jean M. Auel,-1
1494,Children of the Living God,Sinclair B. Ferguson,1987
1495,The King of Children: The Life and Death of Janusz Korczak,Betty Jean Lifton,1988
1496,Dear Laura: Letters from Children to Laura Ingalls Wilder,Laura Ingalls Wilder,1996
1497,"Morning Sun (Children of Nostradamus, #0)",Jeremy Flagg,-1
1498,Midnight and Moonlight: A Children's Picture Book,Peggy Sullivan,2015
